{"schemaVersion":1,"source":{"name":"dashboard.components","sha256":"aaaaaaaaaaaaaaaaaaaaaaaaaaaaaaaaaaaaaaaaaaaaaaaaaaaaaaaaaaaaaaaa"},"targetRoot":"_llmwiki/data-views","files":[{"path":"_llmwiki/data-views/issues.md","beforeSha256":"bbbbbbbbbbbbbbbbbbbbbbbbbbbbbbbbbbbbbbbbbbbbbbbbbbbbbbbbbbbbbbbb","before":"old","after":"new","afterSha256":"cccccccccccccccccccccccccccccccccccccccccccccccccccccccccccccccc"}],"selectedItemIds":["issues-table"],"warnings":["Unsupported renderer option ignored"],"provenance":{"actor":"user","origin":"import"},"fingerprint":"dddddddddddddddddddddddddddddddddddddddddddddddddddddddddddddddd"}